{
  "$schema": "https://json-schema.org/draft/2020-12/schema",
  "$id": "https://raw.githubusercontent.com/m-dev-tools/.github/main/profile/repo.meta.schema.json",
  "title": "m-dev-tools repo manifest",
  "description": "Per-repo machine-readable manifest. Each m-dev-tools repo emits one of these at dist/repo.meta.json. The org-level catalog generator reads only this file and follows its `exposes` pointers — it never has to know what a 'command' or 'module' or 'rule' looks like internally.",
  "type": "object",
  "required": [
    "id",
    "repo",
    "role",
    "language",
    "license",
    "agent_instructions",
    "verified_on",
    "exposes",
    "verification_commands"
  ],
  "additionalProperties": false,
  "properties": {
    "$schema": {
      "type": "string",
      "format": "uri"
    },
    "id": {
      "type": "string",
      "pattern": "^tool:[a-z0-9_-]+$",
      "description": "Typed catalog ID. Phase 0 emits only tool-level IDs."
    },
    "repo": {
      "type": "string",
      "format": "uri",
      "description": "Canonical GitHub URL of the repo."
    },
    "role": {
      "type": "string",
      "minLength": 1,
      "description": "One-sentence description of what the repo provides."
    },
    "language": {
      "type": "array",
      "minItems": 1,
      "items": {
        "type": "string",
        "minLength": 1
      },
      "description": "Primary languages used by the repo (e.g. ['python'], ['m'], ['typescript'])."
    },
    "license": {
      "type": "string",
      "minLength": 1,
      "description": "SPDX license identifier (e.g. 'AGPL-3.0', 'MIT')."
    },
    "agent_instructions": {
      "type": "string",
      "minLength": 1,
      "description": "Path (relative to repo root) to the canonical agent-instructions file. Convention: 'AGENTS.md' with 'CLAUDE.md' symlinked to it."
    },
    "verified_on": {
      "type": "string",
      "pattern": "^[0-9]{4}-[0-9]{2}-[0-9]{2}$",
      "description": "Date this manifest was last regenerated and verified accurate (YYYY-MM-DD)."
    },
    "exposes": {
      "type": "object",
      "minProperties": 1,
      "additionalProperties": {
        "type": "string",
        "minLength": 1
      },
      "description": "Map from logical kind ('commands', 'modules', 'lint_rules', ...) to a path (relative to repo root) or absolute URL where the structured payload lives. Repos declare what they own; the org generator follows these pointers."
    },
    "consumes": {
      "type": "array",
      "items": {
        "type": "string",
        "pattern": "^tool:[a-z0-9_-]+$"
      },
      "description": "Typed IDs of other repos this one depends on at build or runtime."
    },
    "verification_commands": {
      "type": "array",
      "minItems": 1,
      "items": {
        "type": "string",
        "minLength": 1
      },
      "description": "Shell commands an agent should run to verify a change in this repo (e.g. 'make check', 'm doctor')."
    },
    "status": {
      "type": "string",
      "enum": ["active", "archived", "deprecated"],
      "description": "Repo lifecycle status. Defaults to 'active' when omitted."
    },
    "notes": {
      "type": "string",
      "description": "Free-text notes for human readers. Not consumed by the catalog generator."
    }
  }
}
