{
  "$schema": "https://raw.githubusercontent.com/m-dev-tools/.github/main/profile/repo.meta.schema.json",
  "id": "tool:example-repo",
  "repo": "https://github.com/m-dev-tools/example-repo",
  "role": "Canonical example — not a real repo. Copy and adapt for a new m-dev-tools repo onboarding.",
  "language": ["python"],
  "license": "AGPL-3.0",
  "agent_instructions": "AGENTS.md",
  "verified_on": "2026-05-10",
  "exposes": {
    "schema": "profile/repo.meta.schema.json"
  },
  "consumes": [],
  "verification_commands": [
    "make check",
    "make check-manifest"
  ],
  "status": "active",
  "notes": "The `exposes` entry points at the schema file relative to this repo's root (resolved via .git ancestor walk) so the validator's resolve step has a real payload to fetch + JSON-parse. Real repos use paths like 'dist/commands.json' or 'docs/integrated/grammar-surface.json' relative to their own repo roots."
}
